{"compatible_action_profiles":["semantic-grid-actions-v1"],"decision_points":["waypoint_reached","movement_blocked","target_disappeared","lease_expired"],"description":"Agent-side planning template for expanding an objective-declared sequence of visible approachable targets into explicit direct-only move_to steps.","execution":"agent_expands_to_visible_actions","preconditions":[{"kind":"ordered_waypoints_visible","parameters":{},"subject":null}],"protocol":"worldeval-agent/0.1.0","required_target_affordances":["approachable"],"required_tool_affordances":[],"schema_version":"skill-manifest.v1","skill_id":"navigation.follow-visible-waypoints-v1","success_predicate":{"kind":"route_complete","parameters":{},"subject":null},"suggested_actions":["move_to"]}